<?xml version="1.0" encoding="UTF-8"?>

<!DOCTYPE photographers SYSTEM "photographers.dtd">

<photographers>

    <photographer>
        <name>Arjun</name>
        <category>Nature</category>
        <location>Hyderabad</location>
    </photographer>

    <photographer>
        <name>Rahul</name>
        <category>Wildlife</category>
        <location>Bangalore</location>
    </photographer>

    <photographer>
        <name>Sarah</name>
        <category>Portrait</category>
        <location>Mumbai</location>
    </photographer>

</photographers>